{
  "changed_files": [],
  "commands": [
    {
      "argv": [
        "/tmp/plan26_n30_verify/bin/python",
        "-m",
        "pytest",
        "-q",
        "tests/runtime/test_plan26_repair_acceptance.py"
      ],
      "exit_code": 0,
      "finished_at": "2026-08-13T00:05:54.472839+00:00",
      "log": "plans/26_langgraph_curriculum_factory/results/v3/logs/N31_REPAIR_ACCEPTANCE/reverify-shared-output-1786579550943.test1.log",
      "log_sha256": "9e287683e12ea927606d7f65c567bef985c98baf42176a6abf211884e407d0f6",
      "started_at": "2026-08-13T00:05:50.943866+00:00",
      "tail": "......................................                                   [100%]\n38 passed in 1.62s\n",
      "timed_out": false
    },
    {
      "argv": [
        "/tmp/plan26_n30_verify/bin/python",
        "-m",
        "pytest",
        "-q",
        "tests/runtime/test_plan26_unit_graph.py"
      ],
      "exit_code": 0,
      "finished_at": "2026-08-13T00:06:03.679692+00:00",
      "log": "plans/26_langgraph_curriculum_factory/results/v3/logs/N31_REPAIR_ACCEPTANCE/reverify-shared-output-1786579550943.test2.log",
      "log_sha256": "1a9ead5d2cf64ad979592d1cc9966959dbe1a00caa5836925d973f4f9e250484",
      "started_at": "2026-08-13T00:05:54.473326+00:00",
      "tail": "........................................................................ [ 77%]\n.....................                                                    [100%]\n93 passed in 8.15s\n",
      "timed_out": false
    }
  ],
  "created_at": "2026-08-13T00:06:03.685089+00:00",
  "findings": [],
  "graph_digest": "18d619bb4eb509d1c6c590699ce2072660f36781c33cbc18a4ad1f9f8501cac7",
  "graph_id": "plan26_langgraph_curriculum_factory_implementation",
  "input_fingerprint": "c4e041194a65642bce98b71b5065a2609950e2cdb003cda565f692994b264a6e",
  "node_definition_sha256": "bc1f863c5e55de1e55fa43465ff17c2ff842df51836d59f09e1687fb07cb0d1f",
  "node_id": "N31_REPAIR_ACCEPTANCE",
  "outputs": {
    "plans/26_langgraph_curriculum_factory/results/N31_REPAIR_ACCEPTANCE.result.v1.md": "325936e48371bf40a638f97d3a5c73137775cfe44f8c8582ee6cb5e048d4224c",
    "plans/26_langgraph_curriculum_factory/results/evidence/N31_REPAIR_ACCEPTANCE": "0dcf50d23e9b9b5954e4b2b1a2d06eddb71d5aab5e6390db326951f9f7e5937b",
    "runtime/langgraph_factory/acceptance.py": "9752736b326e0d58c42affd2166177c42cc0db74626e2b4d83783c8024be1bed",
    "runtime/langgraph_factory/graph.py": "cbd0cdec2d1a0c4fdc14a94e86cc4126ac5ab70f5b0e9ef1fc9e993308dde9c8",
    "runtime/langgraph_factory/repair.py": "976b47410a001b58b9b5c8be62b2bda21ea2fce0feed5744a953d0ae4b05bb23",
    "tests/runtime/test_plan26_repair_acceptance.py": "de6552e7f6d419405ae2cceb619087cc07bf358cc72a6a006cb17b2e3c769385",
    "tests/runtime/test_plan26_unit_graph.py": "eb491faf6e6a7f602908d4279e9d645af9559d83c8e1a7b998d61eec796d093b"
  },
  "prompt_sha256": "66b31c7f2f86c78772a3aed1fb51ed83c7507fda291c8bc8839f9bc555011a00",
  "provenance": {
    "active_patch_ids": [
      "P-N31-001",
      "P-N31-002",
      "P-N31-003"
    ],
    "attempt_id": null,
    "base_graph_digest": "18d619bb4eb509d1c6c590699ce2072660f36781c33cbc18a4ad1f9f8501cac7",
    "base_prompt_sha256": "c540087d0e59c03f924ed65efecd23f18bd7079ec692486f010dd6464fb835a1",
    "branch_id": null,
    "checkpoint": {
      "N30_UNIT_GRAPH": "604240bd43c3708711e7abbb4b1c5204acfbb53a01ed3d9f4575fc85b87abd25"
    },
    "effective_prompt_sha256": "66b31c7f2f86c78772a3aed1fb51ed83c7507fda291c8bc8839f9bc555011a00",
    "harness_digest": "a2e5cd37735b3e953f8388e90253daca8add352e8596899473473643f5ecad32",
    "patch_chain_sha256": "0a84b8d1b9df7abc7427180b3d4114edf2d147d282cf06b5f1abfb3644f43e0f",
    "patch_ids": [
      "P-N31-001",
      "P-N31-002",
      "P-N31-003"
    ]
  },
  "schema_version": 1,
  "source": "reverified_after_downstream_shared_output_update",
  "status": "PASSED"
}
