{
  "changed_files": [],
  "commands": [
    {
      "argv": [
        "/tmp/plan26_n30_verify/bin/python",
        "-m",
        "pytest",
        "-q",
        "tests/runtime/test_plan26_unit_graph.py"
      ],
      "exit_code": 0,
      "finished_at": "2026-08-12T23:07:41.582278+00:00",
      "log": "plans/26_langgraph_curriculum_factory/results/v3/logs/N30_UNIT_GRAPH/reverify-shared-output.test1.log",
      "log_sha256": "5de2420960eba84aaace8c365dac70feb8a884a9d0ae32af051906fc98c29537",
      "started_at": "2026-08-12T23:07:34.082826+00:00",
      "tail": "........................................................................ [ 77%]\n.....................                                                    [100%]\n93 passed in 6.56s\n",
      "timed_out": false
    }
  ],
  "created_at": "2026-08-12T23:07:41.586605+00:00",
  "findings": [],
  "graph_digest": "252ed9088a18eb1fd0991291158eb7fd7c06a3c2c3ce6772f487ccffb8a4375a",
  "graph_id": "plan26_langgraph_curriculum_factory_implementation",
  "input_fingerprint": "3454850e8db30648e78710a02c745ce8321e66408777dc1ffd23e0296657e06c",
  "node_definition_sha256": "e47b6f162855028f57d85d1179f7940805f6a44d19a3a1edfad2c75a8675e452",
  "node_id": "N30_UNIT_GRAPH",
  "outputs": {
    "plans/26_langgraph_curriculum_factory/results/N30_UNIT_GRAPH.result.v1.md": "98249a68aad16ef6fb8c576ecf5f0ad0ca99fc9a475c661bb522f9a145425c8f",
    "plans/26_langgraph_curriculum_factory/results/evidence/N30_UNIT_GRAPH": "e29a6768b8c29a966ffbebcfaa7a4ecf567f6418a9b7e2e98d0df0cb271bed28",
    "runtime/langgraph_factory/graph.py": "efabbd515c4ba2aab811e47a88ac2ffe2742a23fec9b7e46060ec7e385f06aaa",
    "runtime/langgraph_factory/unit_graph.py": "286995f398826be63bc2263ea5148f87b23ee7683973e4245c4ee3687a6f309c",
    "tests/runtime/test_plan26_unit_graph.py": "db62b49c511cea3cc72e6427fdda0fb356f22e5be5dcb00cc6c3a91f4885e54d"
  },
  "prompt_sha256": "e0f398b91fa5e8a5d0d6e48cd49f4ebf11101641de9a410836ba32e8cf73c8af",
  "provenance": {
    "active_patch_ids": [
      "P-N30-001"
    ],
    "attempt_id": null,
    "base_graph_digest": "252ed9088a18eb1fd0991291158eb7fd7c06a3c2c3ce6772f487ccffb8a4375a",
    "base_prompt_sha256": "f78e98cb44f95a2aa108e87301d3e5fcddd0924e68a47333181bf5ebcd7f5e3e",
    "branch_id": null,
    "checkpoint": {
      "N20_GRAPH_COMPILER": "532ba217134249f2157dce7c0247fff41eac8ca39ae65a7351d81adbdda37187",
      "N21_PERSISTENCE_RESUME": "52b4879c03992f28061f231bf532d8cf29e227ed07978ace3bb1e60e7ff50a35",
      "N22_DETERMINISTIC_NODES": "3a185930408fbbc0e90a36c2670b69d02d7174601d582e9947ab8fede2c0c0fc",
      "N23_MODEL_NODES": "93f312e86f079d21654aaca74cecfc8fba513cbce78b2fdf69d7390eb949ea17"
    },
    "effective_prompt_sha256": "e0f398b91fa5e8a5d0d6e48cd49f4ebf11101641de9a410836ba32e8cf73c8af",
    "harness_digest": "a2e5cd37735b3e953f8388e90253daca8add352e8596899473473643f5ecad32",
    "patch_chain_sha256": "7b8acda63af176e1853272284670407d1d9df4292f852612cd46acbb6e8898ff",
    "patch_ids": [
      "P-N30-001"
    ]
  },
  "schema_version": 1,
  "source": "reverified_after_downstream_shared_output_update",
  "status": "PASSED"
}
