{
  "changed_files": [],
  "commands": [
    {
      "argv": [
        "/tmp/plan26_n30_verify/bin/python",
        "-m",
        "pytest",
        "-q",
        "tests/runtime/test_plan26_transport.py",
        "tests/runtime/test_plan26_egress.py"
      ],
      "exit_code": 0,
      "finished_at": "2026-08-15T09:36:37.350091+00:00",
      "log": "plans/26_langgraph_curriculum_factory/results/v3/logs/N13_TRANSPORT_AUTH/adopt-v2.test1.log",
      "log_sha256": "4045f4869672f45f3c90ec56da54c87927b1945e33fed052316fbd828506c4b8",
      "started_at": "2026-08-15T09:36:29.247342+00:00",
      "tail": "........................................................................ [ 37%]\n........................................................................ [ 75%]\n..............................................                           [100%]\n190 passed in 7.35s\n",
      "timed_out": false
    }
  ],
  "created_at": "2026-08-15T09:36:37.354671+00:00",
  "findings": [],
  "graph_digest": "18d619bb4eb509d1c6c590699ce2072660f36781c33cbc18a4ad1f9f8501cac7",
  "graph_id": "plan26_langgraph_curriculum_factory_implementation",
  "input_fingerprint": "1b37c9c2eca84b02dfb8df6b5b89df57cd04f2c0f8f28ad7183786205dfa948a",
  "node_definition_sha256": "c380d8b84397582898ad9a02373aedeb55d72783b7d67934e422bfa260d91c11",
  "node_id": "N13_TRANSPORT_AUTH",
  "outputs": {
    "plans/26_langgraph_curriculum_factory/results/N13_TRANSPORT_AUTH.result.v1.md": "ae681c609bbc2e8dc4815a3fd9d15136ca57e9a1587f8dd5ca0a4a038b2e842a",
    "plans/26_langgraph_curriculum_factory/results/evidence/N13_TRANSPORT_AUTH": "71215b610e153a8ae16ec61c466090ccfd0fff37224ea13c705b4e3c88cd13a3",
    "src/curriculum_factory/langgraph_factory/config": "8b03fbe3ebc9f2a9a2ea36af279e1f529d46b6236fa029d997c72c4152932e6e",
    "src/curriculum_factory/langgraph_factory/egress.py": "d48869dc37df95bc4f861f7ac1c4ae5043ecb417e4b9df6c0e29929c3f7bba4d",
    "src/curriculum_factory/langgraph_factory/prompts": "9844758c17baa7ba2b6569932625ec472ea3e77a3b8ad4b96e928eadc881d2ad",
    "src/curriculum_factory/langgraph_factory/schemas": "807e29c37cdabddbf616cbd0b5981d3fad428cf80d75aa1e68c5bab007ef2d1c",
    "src/curriculum_factory/langgraph_factory/transport.py": "1512dba21864af7884e60dd5150aabeb1bddffeb9627f56a751631c01e2e1c9f",
    "tests/runtime/test_plan26_egress.py": "50edaf81ce255814557892a07d8ea388b8b63a9dd9c91e37187b259a64671559",
    "tests/runtime/test_plan26_transport.py": "296fa6475bb10364e3035ab1e03cfa16a760f0ec6ab19d452b70adbac4ab939e"
  },
  "prompt_sha256": "123d987b166da423f31d03b77f61b2be37ec175d3b90d6d3b091d0c9ac4e0f04",
  "provenance": {
    "active_patch_ids": [],
    "attempt_id": null,
    "base_graph_digest": "18d619bb4eb509d1c6c590699ce2072660f36781c33cbc18a4ad1f9f8501cac7",
    "base_prompt_sha256": "123d987b166da423f31d03b77f61b2be37ec175d3b90d6d3b091d0c9ac4e0f04",
    "branch_id": null,
    "checkpoint": {
      "N00_BASELINE_FREEZE": "7b7a1d830e239f6bcce471ee02f378022e1f386a5784e7fcb6c0d3d6014f311b"
    },
    "effective_prompt_sha256": "123d987b166da423f31d03b77f61b2be37ec175d3b90d6d3b091d0c9ac4e0f04",
    "harness_digest": "a2e5cd37735b3e953f8388e90253daca8add352e8596899473473643f5ecad32",
    "patch_chain_sha256": "4f53cda18c2baa0c0354bb5f9a3ecbe5ed12ab4d8e11ba873c2f11161202b945",
    "patch_ids": []
  },
  "schema_version": 1,
  "source": "adopted_v2_after_focused_verification",
  "status": "PASSED"
}
